{
  "$schema": "https://json-schema.org/draft/2020-12/schema",
  "$id": "https://example.org/genome-to-diffraction/phenix_install_manifest.schema.json",
  "title": "Phenix installation manifest",
  "type": "object",
  "additionalProperties": false,
  "required": [
    "schema_version",
    "status",
    "phenix_version",
    "installation_prefix",
    "phenix_env_sh",
    "installer_sha256",
    "platform",
    "installed_at",
    "required_commands"
  ],
  "allOf": [
    {
      "if": {
        "properties": {"status": {"const": "verified"}},
        "required": ["status"]
      },
      "then": {
        "required": ["phenix_env_sha256"],
        "properties": {
          "phenix_env_sha256": {"type": "string", "pattern": "^[a-f0-9]{64}$"},
          "required_commands": {
            "items": {
              "required": ["executable_sha256"],
              "properties": {
                "executable_sha256": {
                  "type": "string",
                  "pattern": "^[a-f0-9]{64}$"
                },
                "smoke_test_status": {"const": "passed"}
              }
            }
          }
        }
      }
    }
  ],
  "properties": {
    "schema_version": {"const": "1.0"},
    "status": {"enum": ["verified", "failed"]},
    "requested_release": {"type": ["string", "null"]},
    "requested_build": {"type": ["string", "null"]},
    "phenix_version": {"type": "string", "minLength": 1},
    "installation_prefix": {"type": "string", "minLength": 1},
    "phenix_env_sh": {"type": "string", "minLength": 1},
    "phenix_env_sha256": {"type": "string", "pattern": "^[a-f0-9]{64}$"},
    "installer_basename": {"type": ["string", "null"]},
    "installer_sha256": {"type": "string", "pattern": "^[a-f0-9]{64}$"},
    "platform": {
      "type": "object",
      "additionalProperties": false,
      "required": ["os", "architecture"],
      "properties": {
        "os": {"type": "string"},
        "architecture": {"type": "string"},
        "glibc": {"type": ["string", "null"]},
        "os_version": {"type": ["string", "null"]}
      }
    },
    "installed_at": {"type": "string", "format": "date-time"},
    "required_commands": {
      "type": "array",
      "minItems": 1,
      "items": {
        "type": "object",
        "additionalProperties": false,
        "required": ["name", "path", "smoke_test_status"],
        "properties": {
          "name": {"type": "string"},
          "path": {"type": "string"},
          "executable_sha256": {
            "type": ["string", "null"],
            "pattern": "^[a-f0-9]{64}$"
          },
          "smoke_test_status": {"enum": ["passed", "failed", "not_run"]},
          "version_text": {"type": ["string", "null"]}
        }
      }
    },
    "install_log": {"type": ["string", "null"]},
    "verification_log": {"type": ["string", "null"]},
    "current_symlink": {"type": ["string", "null"]},
    "operator_notes": {"type": "array", "items": {"type": "string"}},
    "warnings": {"type": "array", "items": {"type": "string"}}
  }
}
